{
  "$schema": "./statly.ontology.schema.json",
  "ontologyId": "ontology:statly",
  "version": "1.0.0",
  "generated": false,
  "lastVerified": "2026-08-30",
  "description": "Hybrid symbolic and probabilistic knowledge model for the Statly domain, repository, and supported local runtime.",
  "namespaces": {
    "concept": "Statly domain concept",
    "module": "Deep module or owning implementation",
    "interface": "Caller-visible module contract",
    "process": "Runtime process class",
    "store": "Persistent or ephemeral data store",
    "external": "External system or evidence provider",
    "artifact": "Repository-relative evidence artifact",
    "capability": "Supported local development capability",
    "statement": "Symbolic graph statement",
    "evidence": "Evidence item",
    "hypothesis": "Probabilistic graph statement",
    "lineage": "Inference lineage"
  },
  "relationTypes": [
    "owns",
    "identifies",
    "authorizes",
    "scopes",
    "implements",
    "exposes",
    "depends_on",
    "reads_from",
    "writes_to",
    "projects_to",
    "coordinates_via",
    "transports",
    "runs_as",
    "starts_with",
    "verified_by",
    "defined_by",
    "documented_by",
    "requires",
    "supersedes",
    "must_not_own",
    "does_not_authorize",
    "must_not_target"
  ],
  "nodes": [
    {
      "id": "concept:identity",
      "kind": "domain_concept",
      "label": "User identity",
      "description": "Verified knowledge of which user is making a request."
    },
    {
      "id": "concept:authorization",
      "kind": "domain_concept",
      "label": "Domain authorization",
      "description": "League-, season-, role-, and ownership-aware permission to act."
    },
    {
      "id": "concept:protected_fantasy_state",
      "kind": "domain_concept",
      "label": "Protected fantasy state",
      "description": "League, season, membership, draft, pick, roster, lineup, matchup, trade, and waiver state."
    },
    {
      "id": "concept:league_scope",
      "kind": "domain_concept",
      "label": "League scope",
      "description": "Tenant identity retained by every protected operation."
    },
    {
      "id": "concept:season_scope",
      "kind": "domain_concept",
      "label": "League season scope",
      "description": "Season identity retained by season-dependent protected operations."
    },
    {
      "id": "concept:live_stat_evidence",
      "kind": "domain_concept",
      "label": "Live AFL stat evidence",
      "description": "Normalized external match-stat evidence used by fantasy calculations."
    },
    {
      "id": "concept:realtime_delivery",
      "kind": "domain_concept",
      "label": "Realtime delivery",
      "description": "Bidirectional delivery that converges on persisted server-authoritative state."
    },
    {
      "id": "concept:fail_closed_ingestion",
      "kind": "domain_concept",
      "label": "Fail-closed ingestion",
      "description": "External fetch, parse, validation, or write failure fails the production ingestion cycle."
    },
    {
      "id": "concept:reconnect_catch_up",
      "kind": "domain_concept",
      "label": "Reconnect catch-up",
      "description": "Recovery behavior that rebuilds current realtime state from persisted authority after disconnection."
    },
    {
      "id": "module:prisma_domain_services",
      "kind": "module",
      "label": "Prisma domain services",
      "description": "Owning modules for protected relational fantasy state."
    },
    {
      "id": "module:league_services",
      "kind": "module",
      "label": "League services",
      "description": "League scoring, standings, fixtures, and competition-rule implementation."
    },
    {
      "id": "module:draft_services",
      "kind": "module",
      "label": "Draft services",
      "description": "Persisted draft commands, picks, projections, and publication."
    },
    {
      "id": "module:etl_pipeline",
      "kind": "module",
      "label": "AFL ETL pipeline",
      "description": "Fetches, validates, normalizes, and writes external AFL evidence."
    },
    {
      "id": "interface:http_routes",
      "kind": "interface",
      "label": "HTTP transport routes",
      "description": "Authenticated transport adapters that delegate domain authorization to owning modules."
    },
    {
      "id": "interface:socket_commands",
      "kind": "interface",
      "label": "Socket command interface",
      "description": "Realtime commands and events with persisted catch-up behavior."
    },
    {
      "id": "process:web",
      "kind": "runtime_process",
      "label": "Next.js web and API process",
      "description": "Serves the application and HTTP transport routes."
    },
    {
      "id": "process:socket",
      "kind": "runtime_process",
      "label": "Socket.IO process",
      "description": "Runs bidirectional realtime rooms and delivery."
    },
    {
      "id": "process:draft_worker",
      "kind": "runtime_process",
      "label": "Draft worker process",
      "description": "Runs delayed and background draft work through BullMQ."
    },
    {
      "id": "process:etl",
      "kind": "runtime_process",
      "label": "ETL process",
      "description": "Runs supported AFL ingestion and normalization."
    },
    {
      "id": "store:prisma_sqlite",
      "kind": "store",
      "label": "Prisma SQLite development store",
      "description": "Supported local relational store; disposable databases are required for tests.",
      "durability": "durable_local"
    },
    {
      "id": "store:prisma_dev_db",
      "kind": "store",
      "label": "Protected local Prisma development database",
      "description": "The repository-local development database that must never be read as ontology evidence or selected as a test target.",
      "durability": "durable_local"
    },
    {
      "id": "store:postgresql_target",
      "kind": "store",
      "label": "Managed PostgreSQL production target",
      "description": "Accepted production relational target whose cutover is not complete.",
      "durability": "durable"
    },
    {
      "id": "store:firestore",
      "kind": "store",
      "label": "Firestore",
      "description": "Ingestion evidence and temporary compatibility projection surface.",
      "durability": "durable_projection"
    },
    {
      "id": "store:redis",
      "kind": "store",
      "label": "Redis",
      "description": "Ephemeral queues, locks, caches, rate limits, and Pub/Sub coordination.",
      "durability": "ephemeral"
    },
    {
      "id": "external:firebase_auth",
      "kind": "external_system",
      "label": "Firebase Authentication",
      "description": "Identity provider whose verified UID is an input to domain authorization."
    },
    {
      "id": "external:footywire_fitzroy",
      "kind": "external_system",
      "label": "Footywire through fitzRoy",
      "description": "Supported external AFL data source."
    },
    {
      "id": "capability:node22_npm",
      "kind": "local_capability",
      "label": "Node.js 22 and npm",
      "description": "Required JavaScript runtime and package manager."
    },
    {
      "id": "capability:firebase_emulators",
      "kind": "local_capability",
      "label": "Firebase emulators",
      "description": "Supported local Auth and Firestore environment."
    },
    {
      "id": "capability:docker_test_services",
      "kind": "local_capability",
      "label": "Docker test services",
      "description": "Optional local PostgreSQL and Redis services defined by repository configuration."
    },
    {
      "id": "capability:r_etl",
      "kind": "local_capability",
      "label": "R for ETL",
      "description": "Required local capability for fitzRoy-backed ingestion work."
    },
    {
      "id": "capability:disposable_test_database",
      "kind": "local_capability",
      "label": "Disposable test database",
      "description": "Isolated database selected specifically for verification."
    }
  ],
  "evidence": [
    {
      "id": "evidence:agents_guide",
      "kind": "canonical_document",
      "location": "AGENTS.md",
      "digestPolicy": "path_and_review_date"
    },
    {
      "id": "evidence:data_platform_doc",
      "kind": "canonical_document",
      "location": "docs/architecture/data-platform.md",
      "digestPolicy": "path_and_review_date"
    },
    {
      "id": "evidence:fantasy_model_doc",
      "kind": "canonical_document",
      "location": "docs/domain/fantasy-model.md",
      "digestPolicy": "path_and_review_date"
    },
    {
      "id": "evidence:setup_doc",
      "kind": "canonical_document",
      "location": "docs/development/setup.md",
      "digestPolicy": "path_and_review_date"
    },
    {
      "id": "evidence:prisma_schema",
      "kind": "executable_schema",
      "location": "prisma/schema.prisma",
      "digestPolicy": "content_digest_allowed"
    },
    {
      "id": "evidence:package_manifest",
      "kind": "configuration",
      "location": "package.json",
      "digestPolicy": "content_digest_allowed"
    },
    {
      "id": "evidence:docker_compose",
      "kind": "configuration",
      "location": "docker-compose.yml",
      "digestPolicy": "content_digest_allowed"
    },
    {
      "id": "evidence:server_tree",
      "kind": "repository_observation",
      "location": "src/server",
      "digestPolicy": "path_and_review_date"
    },
    {
      "id": "evidence:app_route_tree",
      "kind": "repository_observation",
      "location": "src/app",
      "digestPolicy": "path_and_review_date"
    },
    {
      "id": "evidence:etl_tree",
      "kind": "repository_observation",
      "location": "etl",
      "digestPolicy": "path_and_review_date"
    }
  ],
  "symbolicStatements": [
    {
      "id": "statement:firebase_identifies_user",
      "subject": "external:firebase_auth",
      "predicate": "identifies",
      "object": "concept:identity",
      "epistemicState": "asserted",